{
  "schema_version": 1,
  "class_id": "SE-022",
  "passing_score": 12,
  "maximum_score": 16,
  "criteria": [
    {
      "id": "mechanism",
      "max": 4,
      "evidence": "benchmark fixes workload, correctness oracle, ordering and raw samples"
    },
    {
      "id": "diagnosis",
      "max": 4,
      "evidence": "a one-run or energy conclusion is rejected and replaced with a bounded claim"
    },
    {
      "id": "reproducibility",
      "max": 4,
      "evidence": "versions, fixture, commands and raw evidence allow an independent repetition"
    },
    {
      "id": "limits",
      "max": 4,
      "evidence": "report separates observed, inferred and unmeasured claims and names the next instrument"
    }
  ]
}
