{
  "schema_version": 1,
  "class_id": "SE-055",
  "passing_score": 12,
  "maximum_score": 16,
  "criteria": [
    {
      "id": "mechanism",
      "max": 4,
      "evidence": "growth is derived from operations while empirical timing keeps environment and repetitions explicit"
    },
    {
      "id": "diagnosis",
      "max": 4,
      "evidence": "a small timing result neither becomes a universal duration nor refutes an asymptotic bound"
    },
    {
      "id": "reproducibility",
      "max": 4,
      "evidence": "versions, fixture, commands and raw evidence allow an independent repetition"
    },
    {
      "id": "limits",
      "max": 4,
      "evidence": "report separates observed, inferred and unmeasured claims and names the next instrument"
    }
  ]
}
