{
  "schema_version": 1,
  "class_id": "SE-013",
  "passing_score": 12,
  "maximum_score": 16,
  "criteria": [
    {
      "id": "mechanism",
      "max": 4,
      "evidence": "layer map connects each observation to one interface and excludes microarchitecture"
    },
    {
      "id": "diagnosis",
      "max": 4,
      "evidence": "review refutes a CPU or hardware claim unsupported by runtime evidence"
    },
    {
      "id": "reproducibility",
      "max": 4,
      "evidence": "versions, fixture, commands and raw evidence allow an independent repetition"
    },
    {
      "id": "limits",
      "max": 4,
      "evidence": "report separates observed, inferred and unmeasured claims and names the next instrument"
    }
  ]
}
