{
  "schema_version": 1,
  "class_id": "SE-062",
  "passing_score": 12,
  "maximum_score": 16,
  "criteria": [
    {
      "id": "mechanism",
      "max": 4,
      "evidence": "guard clauses implement an explicit ordered decision table with observable refusals"
    },
    {
      "id": "diagnosis",
      "max": 4,
      "evidence": "branch count alone is rejected when semantic combinations remain untested"
    },
    {
      "id": "reproducibility",
      "max": 4,
      "evidence": "versions, fixture, commands and raw evidence allow an independent repetition"
    },
    {
      "id": "limits",
      "max": 4,
      "evidence": "report separates observed, inferred and unmeasured claims and names the next instrument"
    }
  ]
}
