{
  "schema_version": 1,
  "class_id": "SE-040",
  "passing_score": 12,
  "maximum_score": 16,
  "criteria": [
    {
      "id": "mechanism",
      "max": 4,
      "evidence": "connection, message framing, response wait and retry policy are derived from application guarantees"
    },
    {
      "id": "diagnosis",
      "max": 4,
      "evidence": "a timed-out write remains unknown and is not retried merely because the client saw an error"
    },
    {
      "id": "reproducibility",
      "max": 4,
      "evidence": "versions, fixture, commands and raw evidence allow an independent repetition"
    },
    {
      "id": "limits",
      "max": 4,
      "evidence": "report separates observed, inferred and unmeasured claims and names the next instrument"
    }
  ]
}
